{"componentChunkName":"component---src-templates-docs-tsx","path":"/getting-started/accessibility/","result":{"data":{"site":{"siteMetadata":{"title":"CoreUI for React.js"}},"mdx":{"id":"c7fb01b4-27ab-5af8-ab63-7b7324ea3140","body":"var _excluded = [\"components\"];\nfunction _extends() { _extends = Object.assign ? Object.assign.bind() : function (target) { for (var i = 1; i < arguments.length; i++) { var source = arguments[i]; for (var key in source) { if (Object.prototype.hasOwnProperty.call(source, key)) { target[key] = source[key]; } } } return target; }; return _extends.apply(this, arguments); }\nfunction _objectWithoutProperties(source, excluded) { if (source == null) return {}; var target = _objectWithoutPropertiesLoose(source, excluded); var key, i; if (Object.getOwnPropertySymbols) { var sourceSymbolKeys = Object.getOwnPropertySymbols(source); for (i = 0; i < sourceSymbolKeys.length; i++) { key = sourceSymbolKeys[i]; if (excluded.indexOf(key) >= 0) continue; if (!Object.prototype.propertyIsEnumerable.call(source, key)) continue; target[key] = source[key]; } } return target; }\nfunction _objectWithoutPropertiesLoose(source, excluded) { if (source == null) return {}; var target = {}; var sourceKeys = Object.keys(source); var key, i; for (i = 0; i < sourceKeys.length; i++) { key = sourceKeys[i]; if (excluded.indexOf(key) >= 0) continue; target[key] = source[key]; } return target; }\n/* @jsxRuntime classic */\n/* @jsx mdx */\n\nvar _frontmatter = {\n  \"title\": \"Accessibility\",\n  \"name\": \"Accessibility\",\n  \"description\": \"A brief overview of CoreUI for React features and limitations for the creation of accessible content.\",\n  \"menu\": \"Getting started\",\n  \"route\": \"/getting-started/accessibility\"\n};\nvar layoutProps = {\n  _frontmatter: _frontmatter\n};\nvar MDXLayout = \"wrapper\";\nreturn function MDXContent(_ref) {\n  var components = _ref.components,\n    props = _objectWithoutProperties(_ref, _excluded);\n  return mdx(MDXLayout, _extends({}, layoutProps, props, {\n    components: components,\n    mdxType: \"MDXLayout\"\n  }), mdx(\"p\", null, \"CoreUI for React provides an easy-to-use framework of ready-made styles, layout tools, and interactive components, allowing developers to create websites and applications that are visually appealing, functionally rich, and accessible out of the box.\"), mdx(\"h2\", {\n    \"id\": \"overview-and-limitations\",\n    \"style\": {\n      \"position\": \"relative\"\n    }\n  }, \"Overview and limitations\", mdx(\"a\", {\n    parentName: \"h2\",\n    \"href\": \"#overview-and-limitations\",\n    \"aria-label\": \"overview and limitations permalink\",\n    \"className\": \"anchor-link after\"\n  }, mdx(\"span\", {\n    parentName: \"a\"\n  }, \"#\"))), mdx(\"p\", null, \"The overall accessibility of any project built with CoreUI for React depends in large part on the author's markup, additional styling, and scripting they've included. However, provided that these have been implemented correctly, it should be perfectly possible to create websites and applications with CoreUI for React that fulfill \", mdx(\"a\", {\n    parentName: \"p\",\n    \"href\": \"https://www.w3.org/TR/WCAG21/\",\n    \"target\": \"_blank\",\n    \"rel\": \"nofollow\"\n  }, mdx(\"abbr\", {\n    title: \"Web Content Accessibility Guidelines\"\n  }, \"WCAG\"), \" 2.1\"), \" (A/AA/AAA), \", mdx(\"a\", {\n    parentName: \"p\",\n    \"href\": \"https://www.section508.gov/\",\n    \"target\": \"_blank\",\n    \"rel\": \"nofollow\"\n  }, \"Section 508\"), \", and similar accessibility standards and requirements.\"), mdx(\"h3\", {\n    \"id\": \"structural-markup\",\n    \"style\": {\n      \"position\": \"relative\"\n    }\n  }, \"Structural markup\", mdx(\"a\", {\n    parentName: \"h3\",\n    \"href\": \"#structural-markup\",\n    \"aria-label\": \"structural markup permalink\",\n    \"className\": \"anchor-link after\"\n  }, mdx(\"span\", {\n    parentName: \"a\"\n  }, \"#\"))), mdx(\"p\", null, \"CoreUI for React styling and layout can be applied to a wide range of markup structures. This documentation aims to provide developers with best practice examples to demonstrate the use of CoreUI for React itself and illustrate appropriate semantic markup, including ways in which potential accessibility concerns can be addressed.\"), mdx(\"h3\", {\n    \"id\": \"interactive-components\",\n    \"style\": {\n      \"position\": \"relative\"\n    }\n  }, \"Interactive components\", mdx(\"a\", {\n    parentName: \"h3\",\n    \"href\": \"#interactive-components\",\n    \"aria-label\": \"interactive components permalink\",\n    \"className\": \"anchor-link after\"\n  }, mdx(\"span\", {\n    parentName: \"a\"\n  }, \"#\"))), mdx(\"p\", null, \"CoreUI for React interactive components\\u2014such as modal dialogs, dropdown menus, and custom tooltips\\u2014are designed to work for touch, mouse, and keyboard users. Through the use of relevant \", mdx(\"a\", {\n    parentName: \"p\",\n    \"href\": \"https://www.w3.org/WAI/standards-guidelines/aria/\",\n    \"target\": \"_blank\",\n    \"rel\": \"nofollow\"\n  }, mdx(\"abbr\", {\n    title: \"Web Accessibility Initiative\"\n  }, \"WAI\"), \"-\", mdx(\"abbr\", {\n    title: \"Accessible Rich Internet Applications\"\n  }, \"ARIA\")), \" roles and attributes, these components should also be understandable and operable using assistive technologies (such as screen readers).\"), mdx(\"p\", null, \"Because CoreUI for React components are purposely designed to be fairly generic, authors may need to include further \", mdx(\"abbr\", {\n    title: \"Accessible Rich Internet Applications\"\n  }, \"ARIA\"), \" roles and attributes, as well as JavaScript behavior, to more accurately convey the precise nature and functionality of their component. This is usually noted in the documentation.\"), mdx(\"h3\", {\n    \"id\": \"color-contrast\",\n    \"style\": {\n      \"position\": \"relative\"\n    }\n  }, \"Color contrast\", mdx(\"a\", {\n    parentName: \"h3\",\n    \"href\": \"#color-contrast\",\n    \"aria-label\": \"color contrast permalink\",\n    \"className\": \"anchor-link after\"\n  }, mdx(\"span\", {\n    parentName: \"a\"\n  }, \"#\"))), mdx(\"p\", null, \"Some combinations of colors that currently make up CoreUI for React default palette\\u2014used throughout the framework for things such as button variations, alert variations, form validation indicators\\u2014may lead to \", mdx(\"em\", {\n    parentName: \"p\"\n  }, \"insufficient\"), \" color contrast (below the recommended \", mdx(\"a\", {\n    parentName: \"p\",\n    \"href\": \"https://www.w3.org/TR/WCAG21/#contrast-minimum\",\n    \"target\": \"_blank\",\n    \"rel\": \"nofollow\"\n  }, \"WCAG 2.1 text color contrast ratio of 4.5:1\"), \" and the \", mdx(\"a\", {\n    parentName: \"p\",\n    \"href\": \"https://www.w3.org/TR/WCAG21/#non-text-contrast\",\n    \"target\": \"_blank\",\n    \"rel\": \"nofollow\"\n  }, \"WCAG 2.1 non-text color contrast ratio of 3:1\"), \"), particularly when used against a light background. Authors are encouraged to test their specific uses of color and, where necessary, manually modify/extend these default colors to ensure adequate color contrast ratios.\"), mdx(\"h3\", {\n    \"id\": \"visually-hidden-content\",\n    \"style\": {\n      \"position\": \"relative\"\n    }\n  }, \"Visually hidden content\", mdx(\"a\", {\n    parentName: \"h3\",\n    \"href\": \"#visually-hidden-content\",\n    \"aria-label\": \"visually hidden content permalink\",\n    \"className\": \"anchor-link after\"\n  }, mdx(\"span\", {\n    parentName: \"a\"\n  }, \"#\"))), mdx(\"p\", null, \"Content which should be visually hidden, but remain accessible to assistive technologies such as screen readers, can be styled using the \", mdx(\"inlineCode\", {\n    parentName: \"p\"\n  }, \".visually-hidden\"), \" class. This can be useful in situations where additional visual information or cues (such as meaning denoted through the use of color) need to also be conveyed to non-visual users.\"), mdx(\"pre\", null, mdx(\"code\", {\n    parentName: \"pre\",\n    \"className\": \"language-html\"\n  }, \"<p className=\\\"text-danger\\\">\\n  <span className=\\\"visually-hidden\\\">Danger: </span>\\n  This action is not reversible\\n</p>\\n\")), mdx(\"p\", null, \"For visually hidden interactive controls, such as traditional \\\"skip\\\" links, use the \", mdx(\"inlineCode\", {\n    parentName: \"p\"\n  }, \".visually-hidden-focusable\"), \" class. This will ensure that the control becomes visible once focused (for sighted keyboard users). \", mdx(\"strong\", {\n    parentName: \"p\"\n  }, \"Watch out, compared to the equivalent \", mdx(\"inlineCode\", {\n    parentName: \"strong\"\n  }, \".sr-only\"), \" and \", mdx(\"inlineCode\", {\n    parentName: \"strong\"\n  }, \".sr-only-focusable\"), \" classes in past versions, CoreUI's \", mdx(\"inlineCode\", {\n    parentName: \"strong\"\n  }, \".visually-hidden-focusable\"), \" is a standalone class, and must not be used in combination with the \", mdx(\"inlineCode\", {\n    parentName: \"strong\"\n  }, \".visually-hidden\"), \" class.\")), mdx(\"pre\", null, mdx(\"code\", {\n    parentName: \"pre\",\n    \"className\": \"language-html\"\n  }, \"<a className=\\\"visually-hidden-focusable\\\" href=\\\"#content\\\">Skip to main content</a>\\n\")), mdx(\"h3\", {\n    \"id\": \"reduced-motion\",\n    \"style\": {\n      \"position\": \"relative\"\n    }\n  }, \"Reduced motion\", mdx(\"a\", {\n    parentName: \"h3\",\n    \"href\": \"#reduced-motion\",\n    \"aria-label\": \"reduced motion permalink\",\n    \"className\": \"anchor-link after\"\n  }, mdx(\"span\", {\n    parentName: \"a\"\n  }, \"#\"))), mdx(\"p\", null, \"CoreUI for React includes support for the \", mdx(\"a\", {\n    parentName: \"p\",\n    \"href\": \"https://drafts.csswg.org/mediaqueries-5/#prefers-reduced-motion\",\n    \"target\": \"_blank\",\n    \"rel\": \"nofollow\"\n  }, mdx(\"inlineCode\", {\n    parentName: \"a\"\n  }, \"prefers-reduced-motion\"), \" media feature\"), \". In browsers/environments that allow the user to specify their preference for reduced motion, most CSS transition effects in CoreUI for React (for instance, when a modal dialog is opened or closed, or the sliding animation in carousels) will be disabled, and meaningful animations (such as spinners) will be slowed down.\"), mdx(\"p\", null, \"On browsers that support \", mdx(\"inlineCode\", {\n    parentName: \"p\"\n  }, \"prefers-reduced-motion\"), \", and where the user has \", mdx(\"em\", {\n    parentName: \"p\"\n  }, \"not\"), \" explicitly signaled that they'd prefer reduced motion (i.e. where \", mdx(\"inlineCode\", {\n    parentName: \"p\"\n  }, \"prefers-reduced-motion: no-preference\"), \"), CoreUI for React enables smooth scrolling using the \", mdx(\"inlineCode\", {\n    parentName: \"p\"\n  }, \"scroll-behavior\"), \" property.\"), mdx(\"h2\", {\n    \"id\": \"additional-resources\",\n    \"style\": {\n      \"position\": \"relative\"\n    }\n  }, \"Additional resources\", mdx(\"a\", {\n    parentName: \"h2\",\n    \"href\": \"#additional-resources\",\n    \"aria-label\": \"additional resources permalink\",\n    \"className\": \"anchor-link after\"\n  }, mdx(\"span\", {\n    parentName: \"a\"\n  }, \"#\"))), mdx(\"ul\", null, mdx(\"li\", {\n    parentName: \"ul\"\n  }, mdx(\"a\", {\n    parentName: \"li\",\n    \"href\": \"https://www.w3.org/TR/WCAG21/\",\n    \"target\": \"_blank\",\n    \"rel\": \"nofollow\"\n  }, \"Web Content Accessibility Guidelines (WCAG) 2.1\")), mdx(\"li\", {\n    parentName: \"ul\"\n  }, mdx(\"a\", {\n    parentName: \"li\",\n    \"href\": \"https://www.a11yproject.com/\",\n    \"target\": \"_blank\",\n    \"rel\": \"nofollow\"\n  }, \"The A11Y Project\")), mdx(\"li\", {\n    parentName: \"ul\"\n  }, mdx(\"a\", {\n    parentName: \"li\",\n    \"href\": \"https://developer.mozilla.org/en-US/docs/Web/Accessibility\",\n    \"target\": \"_blank\",\n    \"rel\": \"nofollow\"\n  }, \"MDN accessibility documentation\")), mdx(\"li\", {\n    parentName: \"ul\"\n  }, mdx(\"a\", {\n    parentName: \"li\",\n    \"href\": \"https://tenon.io/\",\n    \"target\": \"_blank\",\n    \"rel\": \"nofollow\"\n  }, \"Tenon.io Accessibility Checker\")), mdx(\"li\", {\n    parentName: \"ul\"\n  }, mdx(\"a\", {\n    parentName: \"li\",\n    \"href\": \"https://developer.paciellogroup.com/resources/contrastanalyser/\",\n    \"target\": \"_blank\",\n    \"rel\": \"nofollow\"\n  }, \"Color Contrast Analyser (CCA)\")), mdx(\"li\", {\n    parentName: \"ul\"\n  }, mdx(\"a\", {\n    parentName: \"li\",\n    \"href\": \"https://github.com/squizlabs/HTML_CodeSniffer\",\n    \"target\": \"_blank\",\n    \"rel\": \"nofollow\"\n  }, \"\\\"HTML Codesniffer\\\" bookmarklet for identifying accessibility issues\")), mdx(\"li\", {\n    parentName: \"ul\"\n  }, mdx(\"a\", {\n    parentName: \"li\",\n    \"href\": \"https://accessibilityinsights.io/\",\n    \"target\": \"_blank\",\n    \"rel\": \"nofollow\"\n  }, \"Microsoft Accessibility Insights\")), mdx(\"li\", {\n    parentName: \"ul\"\n  }, mdx(\"a\", {\n    parentName: \"li\",\n    \"href\": \"https://www.deque.com/axe/\",\n    \"target\": \"_blank\",\n    \"rel\": \"nofollow\"\n  }, \"Deque Axe testing tools\"))));\n}\n;\nMDXContent.isMDXComponent = true;","frontmatter":{"title":"Accessibility","description":"A brief overview of CoreUI for React features and limitations for the creation of accessible content.","name":"Accessibility","route":"/getting-started/accessibility","pro_component":null,"other_frameworks":null,"since":null,"experimental":null},"tableOfContents":{"items":[{"url":"#overview-and-limitations","title":"Overview and limitations","items":[{"url":"#structural-markup","title":"Structural markup"},{"url":"#interactive-components","title":"Interactive components"},{"url":"#color-contrast","title":"Color contrast"},{"url":"#visually-hidden-content","title":"Visually hidden content"},{"url":"#reduced-motion","title":"Reduced motion"}]},{"url":"#additional-resources","title":"Additional resources"}]}}},"pageContext":{"id":"c7fb01b4-27ab-5af8-ab63-7b7324ea3140"}},"staticQueryHashes":["4202924991"]}